{
  "name": "bootstrap-sass-official",
  "version": "3.1.1",
  "homepage": "https://github.com/twbs/bootstrap-sass",
  "authors": [
    "Thomas McDonald",
    "Tristan Harward",
    "Peter Gumeson",
    "Gleb Mazovetskiy"
  ],
  "description": "bootstrap-sass is a Sass-powered version of Bootstrap, ready to drop right into your Sass powered applications.",
  "main": [
    "vendor/assets/stylesheets/bootstrap.scss",
    "vendor/assets/javascripts/bootstrap.js"
  ],
  "keywords": [
    "twbs",
    "bootstrap",
    "sass"
  ],
  "license": "MIT",
  "ignore": [
    "**/.*",
    "lib",
    "tasks",
    "templates",
    "test",
    "*.gemspec",
    "Rakefile",
    "Gemfile"
  ],
  "gitHead": "fff045652ac80fef9d8768b75e62606b092a4d8b",
  "readme": "# Bootstrap for Sass\n\n[![Build Status](https://secure.travis-ci.org/twbs/bootstrap-sass.png?branch=master)](http://travis-ci.org/twbs/bootstrap-sass)\n\n`bootstrap-sass` is a Sass-powered version of [Bootstrap](http://github.com/twbs/bootstrap), ready to drop right into your Sass powered applications.\n\n## Installation\n\nPlease see the appropriate guide for your environment of choice:\n\n### a. Ruby on Rails\n\n`bootstrap-sass` is easy to drop into Rails with the asset pipeline.\n\nIn your Gemfile you need to add the `bootstrap-sass` gem, and ensure that the `sass-rails` gem is present - it is added to new Rails applications by default.\n\n```ruby\ngem 'sass-rails', '>= 3.2' # sass-rails needs to be higher than 3.2\ngem 'bootstrap-sass', '~> 3.1.1'\n```\n\n`bundle install` and restart your server to make the files available through the pipeline.\n\n\n#### Rails 3.2.x\n\nFor Rails 3.2.x, make sure that all the gems are moved out of the `:assets` group, and `config.assets.initialize_on_precompile` is set to `true`.\n\n\n### b. Compass without Rails\n\nInstall the gem\n```sh\ngem install bootstrap-sass\n```\n\nIf you have an existing Compass project:\n\n```ruby\n# config.rb:\nrequire 'bootstrap-sass'\n```\n\n```console\nbundle exec compass install bootstrap\n```\n\nIf you are creating a new Compass project, you can generate it with bootstrap-sass support:\n\n```console\nbundle exec compass create my-new-project -r bootstrap-sass --using bootstrap\n```\n\nThis will create a new Compass project with the following files in it:\n\n* [_variables.scss](/templates/project/_variables.scss.erb) - all of bootstrap variables (override them here).\n* [styles.scss](/templates/project/styles.scss) - main project SCSS file, import `variables` and `bootstrap`.\n\nSome bootstrap-sass mixins may conflict with the Compass ones.\nIf this happens, change the import order so that Compass mixins are loaded later.\n\n### c. Ruby without Compass / Rails\n\nRequire the gem, and load paths and Sass helpers will be configured automatically:\n\n```ruby\nrequire 'bootstrap-sass'\n```\n\n### d. Bower\n\nUsing bootstrap-sass as a Bower package is still being tested and requires libsass master. You can install it with:\n\n```bash\nbower install git://github.com/twbs/bootstrap-sass.git\n```\n\n`bootstrap-sass` is taken so make sure you use the Git URL above.\n\nSass, JS, and all other assets are located at [vendor/assets](/vendor/assets).\n\nbootstrap-sass [requires](https://github.com/twbs/bootstrap-sass/issues/409) minimum [Sass number precision][sass-precision] of 10 (default is 5).\n\n\nWhen using ruby Sass compiler with the bower version you can enforce the limit with:\n\n```ruby\n::Sass::Script::Number.precision = [10, ::Sass::Script::Number.precision].max\n```\n\n#### JS and fonts\n\nAssets are discovered automatically on Rails, Sprockets, and Compass, using native asset path helpers.\n\nOtherwise the fonts are referenced as:\n\n```sass\n\"#{$icon-font-path}/#{$icon-font-name}.eot\"\n```\n\n`$icon-font-path` defaults to `bootstrap/`.\n\nWhen not using an asset pipeline, you can copy fonts and JS from bootstrap-sass, they are located at [vendor/assets](/vendor/assets):\n\n```bash\nmkdir public/fonts\ncp -r $(bundle show bootstrap-sass)/vendor/assets/fonts/ public/fonts/\nmkdir public/javascripts\ncp -r $(bundle show bootstrap-sass)/vendor/assets/javascripts/ public/javascripts/\n```\n\n## Usage\n\n### Sass\n\nImport Bootstrap into a Sass file (for example, `application.css.scss`) to get all of Bootstrap's styles, mixins and variables!\nWe recommend against using `//= require` directives, since none of your other stylesheets will be [able to access][antirequire] the Bootstrap mixins or variables.\n\n```scss\n@import \"bootstrap\";\n```\n\nYou can also include optional bootstrap theme:\n\n```scss\n@import \"bootstrap/theme\";\n```\n\nThe full list of bootstrap variables can be found [here](http://getbootstrap.com/customize/#less-variables). You can override these by simply redefining the variable before the `@import` directive, e.g.:\n\n```scss\n$navbar-default-bg: #312312;\n$light-orange: #ff8c00;\n$navbar-default-color: $light-orange;\n\n@import \"bootstrap\";\n```\n\nYou can also import components explicitly. To start with a full list of modules copy this file from the gem:\n\n```bash\ncp $(bundle show bootstrap-sass)/vendor/assets/stylesheets/bootstrap.scss \\\n app/assets/stylesheets/bootstrap-custom.scss\n```\nComment out components you do not want from `bootstrap-custom`.\n\nIn `application.sass`, replace `@import 'bootstrap'` with:\n\n```scss\n  @import 'bootstrap-custom';\n```\n\n### Javascript\n\nWe have a helper that includes all Bootstrap javascripts. If you use Rails (or Sprockets separately), \nput this in your Javascript manifest (usually in `application.js`) to load the files in the [correct order](/vendor/assets/javascripts/bootstrap.js):\n\n```js\n// Loads all Bootstrap javascripts\n//= require bootstrap\n```\n\nYou can also load individual modules, provided you also require any dependencies. You can check dependencies in the [Bootstrap JS documentation][jsdocs].\n\n```js\n//= require bootstrap/scrollspy\n//= require bootstrap/modal\n//= require bootstrap/dropdown\n```\n\n---\n\n## Development and Contributing\n\nIf you'd like to help with the development of bootstrap-sass itself, read this section.\n\n### Upstream Converter\n\nKeeping bootstrap-sass in sync with upstream changes from Bootstrap used to be an error prone and time consuming manual process. With Bootstrap 3 we have introduced a converter that automates this.\n\n**Note: if you're just looking to *use* Bootstrap 3, see the [installation](#installation) section above.**\n\nUpstream changes to the Bootstrap project can now be pulled in using the `convert` rake task.\n\nHere's an example run that would pull down the master branch from the main [twbs/bootstrap](https://github.com/twbs/bootstrap) repo:\n    \n    rake convert\n    \nThis will convert the latest LESS to SASS and update to the latest JS.\nTo convert a specific branch or version, pass the branch name or the commit hash as the first task argument:\n    \n    rake convert[e8a1df5f060bf7e6631554648e0abde150aedbe4]\n\nThe latest converter script is located [here][converter] and does the following:\n\n* Converts upstream bootstrap LESS files to its matching SCSS file.\n* Copies all upstream JavaScript into `vendor/assets/javascripts/bootstrap`\n* Generates a javascript manifest at `vendor/assets/javascripts/bootstrap.js`\n* Copies all upstream font files into `vendor/assets/fonts/bootstrap`\n* Sets `Bootstrap::BOOTSTRAP_SHA` in [version.rb][version] to the branch sha.\n\nThis converter fully converts original LESS to SCSS. Conversion is automatic but requires instructions for certain transformations (see converter output).\nPlease submit GitHub issues tagged with `conversion`.\n\n## Credits\n\nbootstrap-sass has a number of major contributors:\n\n<!-- feel free to make these link wherever you wish -->\n* [Thomas McDonald](https://twitter.com/thomasmcdonald_)\n* [Tristan Harward](http://www.trisweb.com)\n* Peter Gumeson\n* [Gleb Mazovetskiy](https://github.com/glebm)\n\nand a [significant number of other contributors][contrib].\n\n## You're in good company\nbootstrap-sass is used to build some awesome projects all over the web, including\n[Diaspora](http://diasporaproject.org/), [rails_admin](https://github.com/sferik/rails_admin),\nMichael Hartl's [Rails Tutorial](http://railstutorial.org/), [gitlabhq](http://gitlabhq.com/) and\n[kandan](http://kandanapp.com/).\n\n[converter]: https://github.com/twbs/bootstrap-sass/blob/master/tasks/converter/less_conversion.rb\n[version]: https://github.com/twbs/bootstrap-sass/blob/master/lib/bootstrap-sass/version.rb\n[contrib]: https://github.com/twbs/bootstrap-sass/graphs/contributors\n[antirequire]: https://github.com/twbs/bootstrap-sass/issues/79#issuecomment-4428595\n[jsdocs]: http://getbootstrap.com/javascript/#transitions\n[sass-precision]: http://sass-lang.com/documentation/Sass/Script/Number.html#precision-class_method\n",
  "readmeFilename": "README.md",
  "_id": "bootstrap-sass@3.1.1",
  "repository": {
    "type": "git",
    "url": "git://github.com/twbs/bootstrap-sass.git"
  }
}